<?xml version="1.0" encoding="UTF-8"?>
<xs:schema attributeFormDefault="unqualified" elementFormDefault="qualified" xmlns:xs="http://www.w3.org/2001/XMLSchema">
  <xs:element name="Biblioteca">
    <xs:complexType>
      <xs:sequence>
        <xs:element name="Libro" maxOccurs="unbounded" minOccurs="0">
          <xs:complexType>
            <xs:sequence>
              <xs:element type="xs:string" name="Titulo"/>
              <xs:element type="xs:string" name="Autor" maxOccurs="unbounded" minOccurs="0"/>
              <xs:element name="Editado" minOccurs="0">
                <xs:complexType>
                  <xs:simpleContent>
                    <xs:extension base="xs:string">
                      <xs:attribute type="xs:string" name="editorial" use="optional"/>
                      <xs:attribute type="xs:short" name="aÃ±o" use="optional"/>
                    </xs:extension>
                  </xs:simpleContent>
                </xs:complexType>
              </xs:element>
            </xs:sequence>
            <xs:attribute type="xs:string" name="ISBN" use="optional"/>
            <xs:attribute type="xs:string" name="recomendar" use="optional"/>
          </xs:complexType>
        </xs:element>
      </xs:sequence>
    </xs:complexType>
  </xs:element>
</xs:schema>